{
  "format": "triangle-packing-atlas-sharded-release/v1",
  "version": "2.0.0",
  "recordCount": 304,
  "recordsPerShard": 76,
  "release": {
    "format": "triangle-packing-atlas/v2",
    "version": "2.0.0",
    "releasedAt": "2026-07-26T00:00:00.000Z",
    "license": "CC-BY-4.0",
    "citation": "CITATION.cff",
    "methodology": "docs/METHODOLOGY_V2.md",
    "claimPolicy": "literature/CLAIM_POLICY.md",
    "finiteDomainProofIndex": "public/finite-domain-proofs-v2.json",
    "finiteDomainProofJobIndex": "public/finite-domain-proof-jobs-v2.json",
    "shardedReleaseIndex": "public/atlas-v2-shards.json",
    "contributionStatus": "public/contribution-status-v2.json",
    "verificationPolicy": {
      "independentImplementations": [
        "src/atlas/verifier.js",
        "independent_verifier/verify_release.py"
      ],
      "tolerancePolicy": "docs/NUMERICAL_POLICY.md",
      "certificateRequired": true
    },
    "coverage": {
      "records": 304,
      "verified": 304,
      "provenOptimal": 3,
      "families": {
        "isosceles": 224,
        "equilateral": 16,
        "right": 16,
        "scalene": 48
      },
      "openDistributedTasks": 301,
      "phaseTransitions": 38,
      "adaptivelyImproved": 11
    },
    "transitions": [
      {
        "apexAngle": 35,
        "betweenRatios": [
          0.75,
          0.9
        ],
        "from": "vertical lattice",
        "to": "acute horizontal lattice",
        "evidence": [
          "iso-a35-r0p75",
          "iso-a35-r0p9"
        ]
      },
      {
        "apexAngle": 35,
        "betweenRatios": [
          1.05,
          1.2
        ],
        "from": "acute horizontal lattice",
        "to": "vertical lattice",
        "evidence": [
          "iso-a35-r1p05",
          "iso-a35-r1p2"
        ]
      },
      {
        "apexAngle": 35,
        "betweenRatios": [
          1.35,
          1.5
        ],
        "from": "vertical lattice",
        "to": "acute horizontal lattice",
        "evidence": [
          "iso-a35-r1p35",
          "iso-a35-r1p5"
        ]
      },
      {
        "apexAngle": 40,
        "betweenRatios": [
          0.75,
          0.9
        ],
        "from": "vertical lattice",
        "to": "acute horizontal lattice",
        "evidence": [
          "iso-a40-r0p75",
          "iso-a40-r0p9"
        ]
      },
      {
        "apexAngle": 40,
        "betweenRatios": [
          1.05,
          1.2
        ],
        "from": "acute horizontal lattice",
        "to": "vertical lattice",
        "evidence": [
          "iso-a40-r1p05",
          "iso-a40-r1p2"
        ]
      },
      {
        "apexAngle": 40,
        "betweenRatios": [
          1.35,
          1.5
        ],
        "from": "vertical lattice",
        "to": "acute horizontal lattice",
        "evidence": [
          "iso-a40-r1p35",
          "iso-a40-r1p5"
        ]
      },
      {
        "apexAngle": 40,
        "betweenRatios": [
          1.5,
          1.65
        ],
        "from": "acute horizontal lattice",
        "to": "vertical lattice",
        "evidence": [
          "iso-a40-r1p5",
          "iso-a40-r1p65"
        ]
      },
      {
        "apexAngle": 40,
        "betweenRatios": [
          1.65,
          1.8
        ],
        "from": "vertical lattice",
        "to": "acute horizontal lattice",
        "evidence": [
          "iso-a40-r1p65",
          "iso-a40-r1p8"
        ]
      },
      {
        "apexAngle": 45,
        "betweenRatios": [
          0.9,
          1.05
        ],
        "from": "acute horizontal lattice",
        "to": "vertical lattice",
        "evidence": [
          "iso-a45-r0p9",
          "iso-a45-r1p05"
        ]
      },
      {
        "apexAngle": 45,
        "betweenRatios": [
          1.05,
          1.2
        ],
        "from": "vertical lattice",
        "to": "acute horizontal lattice",
        "evidence": [
          "iso-a45-r1p05",
          "iso-a45-r1p2"
        ]
      },
      {
        "apexAngle": 45,
        "betweenRatios": [
          1.5,
          1.65
        ],
        "from": "acute horizontal lattice",
        "to": "vertical lattice",
        "evidence": [
          "iso-a45-r1p5",
          "iso-a45-r1p65"
        ]
      },
      {
        "apexAngle": 45,
        "betweenRatios": [
          1.65,
          1.8
        ],
        "from": "vertical lattice",
        "to": "acute horizontal lattice",
        "evidence": [
          "iso-a45-r1p65",
          "iso-a45-r1p8"
        ]
      },
      {
        "apexAngle": 50,
        "betweenRatios": [
          0.9,
          1.05
        ],
        "from": "acute horizontal lattice",
        "to": "vertical lattice",
        "evidence": [
          "iso-a50-r0p9",
          "iso-a50-r1p05"
        ]
      },
      {
        "apexAngle": 50,
        "betweenRatios": [
          1.05,
          1.2
        ],
        "from": "vertical lattice",
        "to": "acute horizontal lattice",
        "evidence": [
          "iso-a50-r1p05",
          "iso-a50-r1p2"
        ]
      },
      {
        "apexAngle": 50,
        "betweenRatios": [
          1.35,
          1.5
        ],
        "from": "acute horizontal lattice",
        "to": "vertical lattice",
        "evidence": [
          "iso-a50-r1p35",
          "iso-a50-r1p5"
        ]
      },
      {
        "apexAngle": 50,
        "betweenRatios": [
          1.5,
          1.65
        ],
        "from": "vertical lattice",
        "to": "acute horizontal lattice",
        "evidence": [
          "iso-a50-r1p5",
          "iso-a50-r1p65"
        ]
      },
      {
        "apexAngle": 50,
        "betweenRatios": [
          1.8,
          1.95
        ],
        "from": "acute horizontal lattice",
        "to": "vertical lattice",
        "evidence": [
          "iso-a50-r1p8",
          "iso-a50-r1p95"
        ]
      },
      {
        "apexAngle": 50,
        "betweenRatios": [
          1.95,
          2.1
        ],
        "from": "vertical lattice",
        "to": "acute horizontal lattice",
        "evidence": [
          "iso-a50-r1p95",
          "iso-a50-r2p1"
        ]
      },
      {
        "apexAngle": 55,
        "betweenRatios": [
          0.75,
          0.9
        ],
        "from": "acute horizontal lattice",
        "to": "vertical lattice",
        "evidence": [
          "iso-a55-r0p75",
          "iso-a55-r0p9"
        ]
      },
      {
        "apexAngle": 55,
        "betweenRatios": [
          0.9,
          1.05
        ],
        "from": "vertical lattice",
        "to": "acute horizontal lattice",
        "evidence": [
          "iso-a55-r0p9",
          "iso-a55-r1p05"
        ]
      },
      {
        "apexAngle": 60,
        "betweenRatios": [
          0.75,
          0.9
        ],
        "from": "acute horizontal lattice",
        "to": "vertical lattice",
        "evidence": [
          "iso-a60-r0p75",
          "iso-a60-r0p9"
        ]
      },
      {
        "apexAngle": 60,
        "betweenRatios": [
          0.9,
          1.05
        ],
        "from": "vertical lattice",
        "to": "acute horizontal lattice",
        "evidence": [
          "iso-a60-r0p9",
          "iso-a60-r1p05"
        ]
      },
      {
        "apexAngle": 60,
        "betweenRatios": [
          1.05,
          1.2
        ],
        "from": "acute horizontal lattice",
        "to": "vertical lattice",
        "evidence": [
          "iso-a60-r1p05",
          "iso-a60-r1p2"
        ]
      },
      {
        "apexAngle": 60,
        "betweenRatios": [
          1.2,
          1.35
        ],
        "from": "vertical lattice",
        "to": "acute horizontal lattice",
        "evidence": [
          "iso-a60-r1p2",
          "iso-a60-r1p35"
        ]
      },
      {
        "apexAngle": 65,
        "betweenRatios": [
          0.75,
          0.9
        ],
        "from": "vertical lattice",
        "to": "obtuse horizontal lattice",
        "evidence": [
          "iso-a65-r0p75",
          "iso-a65-r0p9"
        ]
      },
      {
        "apexAngle": 70,
        "betweenRatios": [
          0.9,
          1.05
        ],
        "from": "obtuse horizontal lattice",
        "to": "vertical lattice",
        "evidence": [
          "iso-a70-r0p9",
          "iso-a70-r1p05"
        ]
      },
      {
        "apexAngle": 70,
        "betweenRatios": [
          1.05,
          1.2
        ],
        "from": "vertical lattice",
        "to": "obtuse horizontal lattice",
        "evidence": [
          "iso-a70-r1p05",
          "iso-a70-r1p2"
        ]
      },
      {
        "apexAngle": 70,
        "betweenRatios": [
          1.2,
          1.35
        ],
        "from": "obtuse horizontal lattice",
        "to": "vertical lattice",
        "evidence": [
          "iso-a70-r1p2",
          "iso-a70-r1p35"
        ]
      },
      {
        "apexAngle": 70,
        "betweenRatios": [
          1.35,
          1.5
        ],
        "from": "vertical lattice",
        "to": "obtuse horizontal lattice",
        "evidence": [
          "iso-a70-r1p35",
          "iso-a70-r1p5"
        ]
      },
      {
        "apexAngle": 75,
        "betweenRatios": [
          0.9,
          1.05
        ],
        "from": "vertical lattice",
        "to": "obtuse horizontal lattice",
        "evidence": [
          "iso-a75-r0p9",
          "iso-a75-r1p05"
        ]
      },
      {
        "apexAngle": 75,
        "betweenRatios": [
          1.05,
          1.2
        ],
        "from": "obtuse horizontal lattice",
        "to": "vertical lattice",
        "evidence": [
          "iso-a75-r1p05",
          "iso-a75-r1p2"
        ]
      },
      {
        "apexAngle": 75,
        "betweenRatios": [
          1.2,
          1.35
        ],
        "from": "vertical lattice",
        "to": "obtuse horizontal lattice",
        "evidence": [
          "iso-a75-r1p2",
          "iso-a75-r1p35"
        ]
      },
      {